<?xml version="1.0" encoding="UTF-8"?>
<xs:schema version="1.0" xmlns:xs="http://www.w3.org/2001/XMLSchema">
	<xs:element name="atreian_passports">
		<xs:complexType>
			<xs:sequence>
				<xs:element maxOccurs="unbounded" ref="atreian_passport"/>
			</xs:sequence>
		</xs:complexType>
	</xs:element>
	<xs:element name="atreian_passport">
		<xs:complexType>
			<xs:sequence>
				<xs:element maxOccurs="unbounded" ref="atreian_passport_reward"/>
			</xs:sequence>
			<xs:attribute name="active" use="required" type="xs:int"/>
			<xs:attribute name="attend_type" use="required" type="xs:string"/>
			<xs:attribute name="id" use="required" type="xs:int"/>
			<xs:attribute name="name" use="required" type="xs:string"/>
		</xs:complexType>
	</xs:element>
	<xs:element name="atreian_passport_reward">
		<xs:complexType>
			<xs:attribute name="name" use="required"/>
			<xs:attribute name="reward_item" use="required" type="xs:int"/>
			<xs:attribute name="reward_item_count" use="required" type="xs:int"/>
			<xs:attribute name="reward_item_num" use="required" type="xs:int"/>
			<xs:attribute name="reward_permit_level" type="xs:int"/>
		</xs:complexType>
	</xs:element>
</xs:schema>
